{
  "meta": {
    "schemaVersion": "0.0.0"
  },
  "title": "Authentic German potato salad, with spacing between ingredient quantity fractions",
  "source": {
    "author": "Angela Louise Miller",
    "location": {
      "url": "https://www.allrecipes.com/recipe/83097/authentic-german-potato-salad/",
      "retrievalDate": "2018-08-11"
    }
  },
  "ingredients": [
    "3 cups potatoes, diced, peeled",
    "4 slices bacon",
    "1 each small onion, diced",
    "1 / 4 cup white vinegar",
    "2 tablespoons water",
    "3 tablespoons white sugar",
    "1 teaspoon salt",
    "1 / 8 teaspoon black pepper, ground",
    "1 tablespoon fresh parsley, chopped"
  ],
  "directions": [
    "Place the potatoes into a pot, and fill with enough water to cover. Bring to a boil, and cook for about 10 minutes, or until easily pierced with a fork. Drain, and set aside to cool.",
    "Place the bacon in a large deep skillet over medium-high heat. Fry until browned and crisp, turning as needed. Remove from the pan and set aside.",
    "Add onion to the bacon grease, and cook over medium heat until browned. Add the vinegar, water, sugar, salt and pepper to the pan. Bring to a boil, then add the potatoes and parsley. Crumble in half of the bacon. Heat through, then transfer to a serving dish. Crumble the remaining bacon over the top, and serve warm."
  ]
}
